ticker,company_name,exchange,ir_url,disclosure_url,seed_source,documents_found
FPT,CTCP FPT,HOSE,,https://finance.vietstock.vn/FPT/tai-tai-lieu.htm?doctype=1,vietstock_finance,7
VCB,Ngân hàng TMCP Ngoại thương Việt Nam,HOSE,,https://finance.vietstock.vn/VCB/tai-tai-lieu.htm?doctype=1,vietstock_finance,7
BID,Ngân hàng TMCP Đầu tư và Phát triển Việt Nam,HOSE,,https://finance.vietstock.vn/BID/tai-tai-lieu.htm?doctype=1,vietstock_finance,7
CTG,Ngân hàng TMCP Công thương Việt Nam,HOSE,,https://finance.vietstock.vn/CTG/tai-tai-lieu.htm?doctype=1,vietstock_finance,7
TCB,Ngân hàng TMCP Kỹ thương Việt Nam,HOSE,,https://finance.vietstock.vn/TCB/tai-tai-lieu.htm?doctype=1,vietstock_finance,7
VPB,Ngân hàng TMCP Việt Nam Thịnh Vượng,HOSE,,https://finance.vietstock.vn/VPB/tai-tai-lieu.htm?doctype=1,vietstock_finance,7
MBB,Ngân hàng TMCP Quân đội,HOSE,,https://finance.vietstock.vn/MBB/tai-tai-lieu.htm?doctype=1,vietstock_finance,7
ACB,Ngân hàng TMCP Á Châu,HOSE,,https://finance.vietstock.vn/ACB/tai-tai-lieu.htm?doctype=1,vietstock_finance,7
HDB,Ngân hàng TMCP Phát triển TP.HCM,HOSE,,https://finance.vietstock.vn/HDB/tai-tai-lieu.htm?doctype=1,vietstock_finance,7
STB,Ngân hàng TMCP Sài Gòn Thương Tín,HOSE,,https://finance.vietstock.vn/STB/tai-tai-lieu.htm?doctype=1,vietstock_finance,7
SSI,CTCP Chứng khoán SSI,HOSE,,https://finance.vietstock.vn/SSI/tai-tai-lieu.htm?doctype=1,vietstock_finance,7
HPG,CTCP Tập đoàn Hòa Phát,HOSE,,https://finance.vietstock.vn/HPG/tai-tai-lieu.htm?doctype=1,vietstock_finance,7
VHM,CTCP Vinhomes,HOSE,,https://finance.vietstock.vn/VHM/tai-tai-lieu.htm?doctype=1,vietstock_finance,7
VIC,Tập đoàn Vingroup - CTCP,HOSE,,https://finance.vietstock.vn/VIC/tai-tai-lieu.htm?doctype=1,vietstock_finance,7
VNM,CTCP Sữa Việt Nam,HOSE,,https://finance.vietstock.vn/VNM/tai-tai-lieu.htm?doctype=1,vietstock_finance,7
MWG,CTCP Đầu tư Thế Giới Di Động,HOSE,,https://finance.vietstock.vn/MWG/tai-tai-lieu.htm?doctype=1,vietstock_finance,7
MSN,CTCP Tập đoàn Masan,HOSE,,https://finance.vietstock.vn/MSN/tai-tai-lieu.htm?doctype=1,vietstock_finance,7
GAS,Tổng Công ty Khí Việt Nam - CTCP,HOSE,,https://finance.vietstock.vn/GAS/tai-tai-lieu.htm?doctype=1,vietstock_finance,7
GVR,Tập đoàn Công nghiệp Cao su Việt Nam - CTCP,HOSE,,https://finance.vietstock.vn/GVR/tai-tai-lieu.htm?doctype=1,vietstock_finance,7
SAB,Tổng CTCP Bia - Rượu - Nước giải khát Sài Gòn,HOSE,,https://finance.vietstock.vn/SAB/tai-tai-lieu.htm?doctype=1,vietstock_finance,7
PLX,Tập đoàn Xăng dầu Việt Nam,HOSE,,https://finance.vietstock.vn/PLX/tai-tai-lieu.htm?doctype=1,vietstock_finance,7
POW,Tổng Công ty Điện lực Dầu khí Việt Nam - CTCP,HOSE,,https://finance.vietstock.vn/POW/tai-tai-lieu.htm?doctype=1,vietstock_finance,7
VJC,CTCP Hàng không VietJet,HOSE,,https://finance.vietstock.vn/VJC/tai-tai-lieu.htm?doctype=1,vietstock_finance,7
BCM,Tổng Công ty Đầu tư và Phát triển Công nghiệp - CTCP,HOSE,,https://finance.vietstock.vn/BCM/tai-tai-lieu.htm?doctype=1,vietstock_finance,7
TPB,Ngân hàng TMCP Tiên Phong,HOSE,,https://finance.vietstock.vn/TPB/tai-tai-lieu.htm?doctype=1,vietstock_finance,7
SHB,Ngân hàng TMCP Sài Gòn - Hà Nội,HOSE,,https://finance.vietstock.vn/SHB/tai-tai-lieu.htm?doctype=1,vietstock_finance,7
SSB,Ngân hàng TMCP Đông Nam Á,HOSE,,https://finance.vietstock.vn/SSB/tai-tai-lieu.htm?doctype=1,vietstock_finance,7
VIB,Ngân hàng TMCP Quốc tế Việt Nam,HOSE,,https://finance.vietstock.vn/VIB/tai-tai-lieu.htm?doctype=1,vietstock_finance,7
LPB,Ngân hàng TMCP Lộc Phát Việt Nam,HOSE,,https://finance.vietstock.vn/LPB/tai-tai-lieu.htm?doctype=1,vietstock_finance,4
